[
  {
    "name": "Greek Yogurt Parfait with Berries & Muesli",
    "category": "breakfast",
    "moods": ["breakfast", "fresh", "quick"],
    "ingredients": {
      "core": ["Greek yogurt", "Mixed berries", "Muesli"],
      "pantry": ["Honey or maple syrup", "Salt (pinch)"]
    },
    "searchTerms": ["yogurt", "berries", "healthy", "light", "fruit", "morning", "easy"]
  },
  {
    "name": "Oatmeal with Banana & PB",
    "category": "breakfast",
    "moods": ["breakfast", "cozy", "quick"],
    "ingredients": {
      "core": ["Oats", "Banana", "Peanut butter"],
      "pantry": ["Water or milk", "Cinnamon (optional)"]
    },
    "searchTerms": ["oats", "oatmeal", "banana", "peanut butter", "warm", "filling", "comfort"]
  },
  {
    "name": "Scrambled Eggs on Buttered Rye",
    "category": "breakfast",
    "moods": ["breakfast", "cozy", "quick"],
    "ingredients": {
      "core": ["Eggs", "Rye bread", "Cherry tomatoes"],
      "pantry": ["Butter", "Olive oil", "Garlic", "Flaky salt"]
    },
    "searchTerms": ["eggs", "scrambled", "rye", "toast", "tomatoes", "savory", "protein", "bread"]
  },
  {
    "name": "Spinach & Mozzarella Omelet",
    "category": "breakfast",
    "moods": ["breakfast", "cozy"],
    "ingredients": {
      "core": ["Eggs", "Spinach", "Mozzarella or provolone"],
      "pantry": ["Butter", "Salt", "Pepper"]
    },
    "searchTerms": ["omelet", "eggs", "spinach", "cheese", "melty", "protein", "veggie"]
  },
  {
    "name": "Bagel with Lox & Cream Cheese",
    "category": "breakfast",
    "moods": ["breakfast", "fresh"],
    "ingredients": {
      "core": ["Bagel", "Smoked salmon", "Cream cheese"],
      "pantry": ["Dill", "Capers (rinsed)", "Lemon zest (optional)"]
    },
    "searchTerms": ["bagel", "lox", "salmon", "cream cheese", "deli", "jewish", "brunch"]
  },
  {
    "name": "Breakfast Burrito",
    "category": "breakfast",
    "moods": ["breakfast", "hearty"],
    "ingredients": {
      "core": ["Eggs", "Potatoes", "Cheese", "Tortilla"],
      "pantry": ["Mild salsa (cilantro-free)", "Guacamole (optional)"]
    },
    "searchTerms": ["burrito", "eggs", "potato", "cheese", "wrap", "mexican", "filling"]
  },
  {
    "name": "Avocado Toast with Egg",
    "category": "breakfast",
    "moods": ["breakfast", "fresh", "quick"],
    "ingredients": {
      "core": ["Avocado", "Bread", "Egg"],
      "pantry": ["Salt", "Olive oil"]
    },
    "searchTerms": ["avocado", "toast", "egg", "healthy", "trendy", "millennial", "brunch", "bread"]
  },
  {
    "name": "Savory Oats with Egg",
    "category": "breakfast",
    "moods": ["breakfast", "cozy"],
    "ingredients": {
      "core": ["Oats", "Egg", "Parmesan"],
      "pantry": ["Chicken stock", "Black pepper"]
    },
    "searchTerms": ["oats", "savory", "egg", "different", "unique", "umami", "broth"]
  },
  {
    "name": "Rye Toast with Burrata & Warm Tomatoes",
    "category": "breakfast",
    "moods": ["breakfast", "fresh"],
    "ingredients": {
      "core": ["Rye bread", "Burrata", "Cherry tomatoes"],
      "pantry": ["Olive oil", "Garlic", "Salt", "Lemon zest (optional)"]
    },
    "searchTerms": ["burrata", "tomatoes", "toast", "fancy", "italian", "creamy", "warm", "bread", "rye"]
  },
  {
    "name": "Fruit & Nuts Plate",
    "category": "breakfast",
    "moods": ["breakfast", "fresh", "quick"],
    "ingredients": {
      "core": ["Melon", "Grapes", "Nectarine or plum", "Mixed nuts"],
      "pantry": []
    },
    "searchTerms": ["fruit", "nuts", "healthy", "light", "raw", "no cook", "simple"]
  },
  {
    "name": "Egg & Cheese Bagel",
    "category": "breakfast",
    "moods": ["breakfast", "hearty", "quick"],
    "ingredients": {
      "core": ["Bagel", "Eggs", "Provolone or mozzarella"],
      "pantry": ["Butter", "Salt", "Pepper"]
    },
    "searchTerms": ["bagel", "egg and cheese", "breakfast", "classic", "quick", "sandwich", "bread"]
  },
  {
    "name": "Turkey Sausage, Egg & Cheese on Rye",
    "category": "breakfast",
    "moods": ["breakfast", "hearty"],
    "ingredients": {
      "core": ["Rye bread", "Turkey sausage", "Eggs", "Provolone"],
      "pantry": ["Butter", "Salt", "Pepper"]
    },
    "searchTerms": ["breakfast sandwich", "sausage egg cheese", "rye", "deli", "classic", "toast", "bread"]
  },
  {
    "name": "Lox, Eggs & Onions Scramble",
    "category": "breakfast",
    "moods": ["breakfast", "cozy", "quick"],
    "ingredients": {
      "core": ["Eggs", "Smoked salmon", "Onion"],
      "pantry": ["Butter", "Salt", "Pepper", "Dill (optional)"]
    },
    "searchTerms": ["lox and eggs", "scramble", "deli", "classic", "smoked salmon"]
  },
  {
    "name": "Spaghetti with Turkey Bolognese",
    "category": "italian",
    "moods": ["italian", "hearty", "cozy"],
    "ingredients": {
      "core": ["Spaghetti", "Ground turkey", "Zucchini (small, grated)", "Parmesan"],
      "pantry": ["Passata", "Onion", "Garlic", "Olive oil"]
    },
    "searchTerms": ["spaghetti", "bolognese", "pasta", "turkey", "meat sauce", "italian", "classic"]
  },
  {
    "name": "Turkey Meatballs in Marinara",
    "category": "italian",
    "moods": ["italian", "hearty", "cozy"],
    "ingredients": {
      "core": ["Ground turkey", "Spaghetti or sub roll", "Parmesan"],
      "pantry": ["Passata", "Breadcrumbs", "Egg", "Garlic", "Italian seasoning"]
    },
    "searchTerms": ["meatballs", "turkey", "marinara", "italian", "sub", "spaghetti", "comfort"]
  },
  {
    "name": "Shrimp Garlic-Butter Pasta",
    "category": "italian",
    "moods": ["italian", "seafood", "quick"],
    "ingredients": {
      "core": ["Pasta", "Shrimp", "Parsley"],
      "pantry": ["Butter", "Garlic", "Chicken stock", "Olive oil"]
    },
    "searchTerms": ["shrimp", "garlic", "butter", "pasta", "seafood", "scampi", "quick"]
  },
  {
    "name": "Tuna, Olive & Capers Rigatoni",
    "category": "italian",
    "moods": ["italian", "seafood", "quick"],
    "ingredients": {
      "core": ["Rigatoni", "Canned tuna", "Olives", "Capers (rinsed)"],
      "pantry": ["Passata", "Garlic", "Olive oil"]
    },
    "searchTerms": ["tuna", "pasta", "olives", "capers", "pantry", "mediterranean", "briny"]
  },
  {
    "name": "Sausage & Peppers with Orzo",
    "category": "italian",
    "moods": ["italian", "hearty"],
    "ingredients": {
      "core": ["Turkey sausage", "Bell peppers", "Onions", "Orzo", "Provolone"],
      "pantry": ["Olive oil", "Garlic", "Italian seasoning"]
    },
    "searchTerms": ["sausage", "peppers", "orzo", "italian", "sheet pan", "easy", "melty"]
  },
  {
    "name": "Pea & Parmesan Orzotto",
    "category": "italian",
    "moods": ["italian", "cozy", "quick"],
    "ingredients": {
      "core": ["Orzo", "Peas", "Parmesan"],
      "pantry": ["Chicken stock", "Butter", "Garlic"]
    },
    "searchTerms": ["orzo", "risotto", "peas", "parmesan", "creamy", "vegetarian", "comfort"]
  },
  {
    "name": "Chicken Parmesan (Baked)",
    "category": "italian",
    "moods": ["italian", "hearty"],
    "ingredients": {
      "core": ["Chicken breast", "Mozzarella", "Parmesan", "Spaghetti"],
      "pantry": ["Passata", "Breadcrumbs", "Flour", "Egg", "Olive oil", "Garlic", "Salt", "Pepper"]
    },
    "searchTerms": ["chicken parm", "parmesan", "baked", "italian american", "melty", "low acid sauce"]
  },
  {
    "name": "Cacio e Pepe (Parmesan)",
    "category": "italian",
    "moods": ["italian", "quick", "cozy"],
    "ingredients": {
      "core": ["Spaghetti", "Parmesan"],
      "pantry": ["Black pepper", "Butter", "Salt"]
    },
    "searchTerms": ["cacio e pepe", "cheesy", "pepper", "pasta", "classic", "no cream"]
  },
  {
    "name": "Pasta e Piselli (Pasta with Peas)",
    "category": "italian",
    "moods": ["italian", "cozy", "quick"],
    "ingredients": {
      "core": ["Small pasta (ditalini or shells)", "Peas", "Parmesan"],
      "pantry": ["Olive oil", "Garlic", "Chicken stock", "Salt", "Pepper"]
    },
    "searchTerms": ["peas", "pasta", "weeknight", "italian", "comfort", "low acid"]
  },
  {
    "name": "Chicken Teriyaki",
    "category": "japanese",
    "moods": ["asian", "quick"],
    "ingredients": {
      "core": ["Chicken thighs", "Rice", "Broccoli or carrots or edamame"],
      "pantry": ["Soy sauce", "Mirin", "Sugar", "Garlic", "Ginger"]
    },
    "searchTerms": ["chicken", "teriyaki", "japanese", "asian", "rice", "sweet", "glazed"]
  },
  {
    "name": "Salmon Teriyaki",
    "category": "japanese",
    "moods": ["asian", "seafood", "quick"],
    "ingredients": {
      "core": ["Salmon", "Rice", "Asparagus or green beans"],
      "pantry": ["Soy sauce", "Mirin", "Sugar", "Sesame seeds"]
    },
    "searchTerms": ["salmon", "teriyaki", "japanese", "fish", "healthy", "glazed", "sesame"]
  },
  {
    "name": "Chicken Katsu Curry",
    "category": "japanese",
    "moods": ["asian", "hearty", "cozy"],
    "ingredients": {
      "core": ["Chicken breast", "Potatoes", "Carrots", "Japanese curry roux (mild)"],
      "pantry": ["Panko", "Flour", "Egg", "Oil for frying"]
    },
    "searchTerms": ["katsu", "curry", "japanese", "fried", "chicken", "comfort", "crispy"]
  },
  {
    "name": "Oyakodon (Chicken & Egg Rice Bowl)",
    "category": "japanese",
    "moods": ["asian", "cozy", "quick"],
    "ingredients": {
      "core": ["Chicken thighs", "Eggs", "Rice", "Scallions"],
      "pantry": ["Soy sauce", "Mirin", "Dashi or chicken stock", "Sugar"]
    },
    "searchTerms": ["oyakodon", "rice bowl", "chicken", "egg", "japanese", "comfort", "donburi"]
  },
  {
    "name": "Yaki Udon",
    "category": "japanese",
    "moods": ["asian", "quick"],
    "ingredients": {
      "core": ["Udon noodles", "Chicken or shrimp", "Bell peppers", "Snap peas"],
      "pantry": ["Soy sauce", "Garlic", "Ginger", "Sesame oil"]
    },
    "searchTerms": ["udon", "noodles", "stir fry", "japanese", "yakisoba", "quick", "veggie"]
  },
  {
    "name": "Gyudon (Beef & Onion Bowl)",
    "category": "japanese",
    "moods": ["asian", "cozy", "quick"],
    "ingredients": {